{
  "protocol_version": "1.0.0",
  "generated_at": "2026-07-28T12:00:00Z",
  "source_sha": "95b9551f0c9b5c8b1a3d8e4f6a7c2d1e5f8b9c0a",
  "verified_sha": "95b9551f0c9b5c8b1a3d8e4f6a7c2d1e5f8b9c0a",
  "branch": "test",
  "worktree_clean": true,
  "commands": [],
  "results": {},
  "failures": [],
  "warnings": [],
  "artifact_hashes": {
    "test.json": "56f3fd843f7ae959a8409e0ae7c067a0e862a6faa7a22bad147ee90ee5992bd7"
  },
  "verdict": "PASS"
}