{
  "protocol_version": "1.0.0",
  "generated_at": "2026-07-29T15:44:13.524524+00:00",
  "source_sha": "6dab084abd3d46cc9f0c9e7dcbb6e65254b83057",
  "verified_sha": "6dab084abd3d46cc9f0c9e7dcbb6e65254b83057",
  "branch": "fix/phase7-verification-integrity",
  "worktree_clean": true,
  "commands": [
    {
      "command_id": "validate_ci_evidence",
      "command": "uv run python scripts/verification/validate_ci_evidence.py",
      "cwd": ".",
      "started_at": "2026-07-29T15:44:13.524524+00:00",
      "finished_at": "2026-07-29T15:44:13.524524+00:00",
      "duration_ms": 1000,
      "exit_code": 0,
      "stdout_tail": "CI evidence validated for 13 required jobs\n",
      "stderr_tail": "",
      "environment": {
        "os": "linux",
        "python": "3.11.15",
        "uv": "0.5.0",
        "git_sha": "6dab084abd3d46cc9f0c9e7dcbb6e65254b83057"
      },
      "expected_exit_codes": [
        0
      ],
      "result": "SUCCESS",
      "stdout_sha256": "981b514983cd7b49e4046210bf8ff8deb25d346a5b42d8659061e4ea35dc5a60",
      "stderr_sha256": "e3b0c44298fc1c149afbf4c8996fb92427ae41e4649b934ca495991b7852b855",
      "output_sha256": "981b514983cd7b49e4046210bf8ff8deb25d346a5b42d8659061e4ea35dc5a60",
      "log_paths": {
        "stdout_log": "receipts/logs/validate_ci_evidence.stdout.log",
        "stderr_log": "receipts/logs/validate_ci_evidence.stderr.log"
      }
    }
  ],
  "failures": [],
  "warnings": [],
  "artifact_hashes": {
    "risk_register.md": "13f668f57b4e798a497d055b7ccf756f83dee58c9ed7c418175644b91925d24d"
  },
  "verdict": "PASS",
  "results": {
    "check": "artifact_schema_validation",
    "validated_artifacts_count": 18
  }
}
