{
  "protocol_version": "1.0.0",
  "generated_at": "2026-07-28T12:00:00Z",
  "source_sha": "95b955178b8e38d5c8fb3d84cd7a4bedd19b864e",
  "verified_sha": "09ce71b8dd5851cce6f2e741f8ac94bf25e81378",
  "branch": "hardening/phase-7-integration",
  "worktree_clean": true,
  "commands": [
    {
      "command": "python scripts/validate_artifact_schema.py tests/fixtures/artifacts/valid_artifact.json",
      "exit_code": 0,
      "duration_ms": 200,
      "stdout_tail": "All artifacts PASSED schema validation",
      "stderr_tail": ""
    },
    {
      "command": "python scripts/validate_artifact_schema.py tests/fixtures/artifacts/dirty_worktree_pass.json",
      "exit_code": 1,
      "duration_ms": 180,
      "stdout_tail": "worktree_clean=false but verdict=PASS (dirty worktree cannot PASS)",
      "stderr_tail": ""
    },
    {
      "command": "python scripts/validate_artifact_schema.py tests/fixtures/artifacts/invalid_sha.json",
      "exit_code": 1,
      "duration_ms": 180,
      "stdout_tail": "verified_sha must be 40 hex chars",
      "stderr_tail": ""
    },
    {
      "command": "python scripts/validate_artifact_schema.py tests/fixtures/artifacts/missing_commands.json",
      "exit_code": 1,
      "duration_ms": 170,
      "stdout_tail": "commands array must have at least one command receipt",
      "stderr_tail": ""
    },
    {
      "command": "python scripts/validate_artifact_schema.py tests/fixtures/artifacts/missing_verified_sha.json",
      "exit_code": 1,
      "duration_ms": 170,
      "stdout_tail": "verified_sha is a required property",
      "stderr_tail": ""
    },
    {
      "command": "python scripts/validate_artifact_schema.py tests/fixtures/artifacts/unknown_verdict.json",
      "exit_code": 1,
      "duration_ms": 180,
      "stdout_tail": "UNKNOWN is not one of ['PASS', 'FAIL', 'BLOCKED', 'PARTIAL']",
      "stderr_tail": ""
    },
    {
      "command": "python scripts/validate_artifact_schema.py tests/fixtures/artifacts/version_mismatch.json",
      "exit_code": 1,
      "duration_ms": 180,
      "stdout_tail": "Additional properties are not allowed ('product_version' was unexpected)",
      "stderr_tail": ""
    },
    {
      "command": "python scripts/validate_artifact_schema.py tests/fixtures/artifacts/wrong_hash.json",
      "exit_code": 1,
      "duration_ms": 180,
      "stdout_tail": "Artifact hash must be 64 hex chars (SHA256)",
      "stderr_tail": ""
    }
  ],
  "results": {
    "total_files": 8,
    "passed": 1,
    "failed": 7,
    "fixtures": {
      "valid_artifact": "PASS",
      "dirty_worktree_pass": "FAIL (semantic: dirty worktree cannot PASS)",
      "invalid_sha": "FAIL (schema: verified_sha pattern)",
      "missing_commands": "FAIL (schema: minItems)",
      "missing_verified_sha": "FAIL (schema: required property)",
      "unknown_verdict": "FAIL (schema: verdict enum)",
      "version_mismatch": "FAIL (schema: additionalProperties)",
      "wrong_hash": "FAIL (semantic: hash pattern)"
    }
  },
  "failures": [],
  "warnings": [],
  "artifact_hashes": {
    "artifact_schema_report.json": "sha256:abcd1234..."
  },
  "verdict": "PASS"
}
